{
  "schema": 1,
  "deviceId": "041bfec6-8923-4b09-be5f-0fd11d3df7f5",
  "projectId": "project-001",
  "assignId": "assign-001",
  "payloads": [
    {
      "session": "2607131922",
      "sequence": 1,
      "startUtc": "2026-07-14T02:20:00.000Z",
      "startBusiness": "2026-07-13T19:20:00.000",
      "businessDate": "2026-07-13",
      "frameCount": 2963,
      "missingSec": 177,
      "confidence": 86.92,
      "isPartial": true,
      "coverage": 0.41,
      "fps": 24.2,
      "areas": [
        {
          "areaId": 0,
          "areaName": "Global",
          "passBy": 1,
          "stay": 0,
          "entry": 0,
          "exit": 0,
          "appear": 0,
          "disappear": 0,
          "avgOccupancy": 0.99,
          "maxOccupancy": 1,
          "avgDwellSec": 60.7,
          "maxDwellSec": 122.0
        }
      ]
    },
    {
      "session": "2607131922",
      "sequence": 2,
      "startUtc": "2026-07-14T02:25:00.000Z",
      "startBusiness": "2026-07-13T19:25:00.000",
      "businessDate": "2026-07-13",
      "frameCount": 7511,
      "missingSec": 5,
      "confidence": 85.66,
      "isPartial": false,
      "coverage": 0.98,
      "fps": 25.5,
      "areas": [
        {
          "areaId": 0,
          "areaName": "Global",
          "passBy": 2,
          "stay": 1,
          "entry": 1,
          "exit": 1,
          "appear": 2,
          "disappear": 2,
          "avgOccupancy": 1.25,
          "maxOccupancy": 2,
          "avgDwellSec": 84.4,
          "maxDwellSec": 201.0
        },
        {
          "areaId": 1,
          "areaName": "Entrance",
          "passBy": 1,
          "stay": 0,
          "entry": 1,
          "exit": 1,
          "appear": 1,
          "disappear": 1,
          "avgOccupancy": 0.72,
          "maxOccupancy": 1,
          "avgDwellSec": 53.8,
          "maxDwellSec": 110.0
        }
      ]
    }
  ]
}